{
  "$schema": "https://json-schema.org/draft/2020-12/schema",
  "$id": "https://schemas.avilalabs.com/core/qualification/v0.1-draft.schema.json",
  "title": "Avila Core Qualification v0.1 draft",
  "description": "A method owner's scoped statement of where one exact capability implementation's evidence may be trusted: a closed applicability predicate over facts an adapter extracts from verified inputs. Evaluated before a step runs; a claim from outside the envelope, or of unknown position, cannot establish a bounded requirement.",
  "type": "object",
  "additionalProperties": false,
  "required": ["schema_version", "qualification_id", "revision", "owner", "adapter", "capability", "statement", "scope"],
  "properties": {
    "schema_version": { "const": "avila.core/qualification/v0.1-draft" },
    "qualification_id": { "type": "string", "minLength": 1 },
    "revision": { "type": "integer", "minimum": 1 },
    "owner": { "type": "string", "minLength": 1 },
    "adapter": { "type": "string", "minLength": 1, "description": "The adapter identifier the qualification covers." },
    "capability": {
      "type": "object",
      "additionalProperties": false,
      "required": ["capability_id", "executable_sha256"],
      "properties": {
        "capability_id": { "type": "string", "minLength": 1 },
        "executable_sha256": { "type": "string", "pattern": "^sha256:[0-9a-f]{64}$" }
      }
    },
    "statement": { "type": "string", "minLength": 1 },
    "scope": { "type": "object", "description": "A kernel applicability predicate: all, any, not, param_in_range, input_attribute_in, environment_image_in, fact." },
    "covered_output_slots": {
      "type": "array",
      "items": { "type": "string", "minLength": 1 },
      "minItems": 1,
      "uniqueItems": true,
      "description": "The bound capability's output slots this record's envelope covers. Omitted (the default) covers every output slot the capability produces. A claim on an output slot not named here carries no qualification assessment at all, exactly as if no record had been bound for the capability: it can still satisfy a nominal-basis requirement, but a bounded or enclosure requirement over it is `CORE-A4402` (or, absent `require_qualification`, informational `CORE-A4403`), never `inside` this record."
    },
    "fact_kinds": { "type": "object", "additionalProperties": { "type": "string" }, "description": "Quantity kind for each quantity-valued fact the scope names." },
    "validation_evidence": {
      "type": "array",
      "items": {
        "type": "object",
        "additionalProperties": false,
        "required": ["description", "sha256"],
        "properties": { "description": { "type": "string" }, "sha256": { "type": "string", "pattern": "^sha256:[0-9a-f]{64}$" } }
      }
    },
    "limitations": { "type": "array", "items": { "type": "string" } },
    "not_after": {
      "type": "string",
      "pattern": "^[0-9]{4}-[0-9]{2}-[0-9]{2}T[0-9]{2}:[0-9]{2}:[0-9]{2}Z$",
      "description": "The last instant this record's assessment may stand, normalized `YYYY-MM-DDTHH:MM:SSZ` so lexical order is chronological. Evaluation never reads a clock — the runner stamps the signed evaluation time into each assessment, and a claim whose record lapsed carries `expired` rather than `inside` (`CORE-A4602`)."
    }
  }
}
